{
  "schema": "gym-come-true/stacked-delivery-manifest/v1",
  "narrativeSource": {
    "path": "docs/git/STACKED_PRS.md",
    "sha256": "bc6ce80f0de529a73f3fce4358c816ed9508f75d8f9dab428c1123fc5e2eb8d9"
  },
  "gitTownRuntime": {
    "executable": "PINNED_CANDIDATE",
    "canary": "NOT_EXERCISED",
    "runtimeAdmitted": false
  },
  "evalSets": [
    "E-BASE",
    "E-DOC",
    "E-GIT",
    "E-IDENTITY"
  ],
  "packets": [
    {
      "id": "S0",
      "status": "MERGED_TO_MAIN",
      "pullRequest": 2,
      "issue": 1,
      "parents": ["main"],
      "head": "agent/bootstrap-kmp-fitness-platform",
      "transition": "EMPTY_REPOSITORY -> AUDITABLE_CROSS_PLATFORM_FOUNDATION",
      "pathLease": ["shared/**", "androidApp/**", "iosApp/**", "webApp/**", "data/**", "legal/**"],
      "evals": ["E-BASE"],
      "negativeControls": ["no client provider secret", "no automatic dose advice", "no unadmitted third-party media"],
      "rollback": "0148e135a4855a700bb666e1181e65611517507c",
      "humanAdmit": ["merge", "release/store promotion"],
      "mergedHeadSha": "58492815f22af65665172bcf98bfb661639ece92"
    },
    {
      "id": "S1",
      "status": "MERGED_TO_MAIN",
      "pullRequest": 15,
      "issue": 8,
      "parents": ["S0"],
      "head": "agent/taiwan-supplement-evidence",
      "transition": "AUDITABLE_CROSS_PLATFORM_FOUNDATION -> TAIWAN_EVIDENCE_CONTRACT_DRAFT",
      "pathLease": ["data/taiwan-supplement/**", "legal/taiwan-supplement-source-registry.json", "scripts/validate_taiwan_rule_pack.py"],
      "evals": ["E-BASE"],
      "negativeControls": ["draft pack cannot execute", "unknown consent denies admission", "model cannot own decision"],
      "rollback": "58492815f22af65665172bcf98bfb661639ece92",
      "humanAdmit": ["clinical/legal acceptance", "merge"],
      "mergedHeadSha": "79f8a65b370806925c32f0a15da88c7c0d7bda36"
    },
    {
      "id": "S2",
      "status": "MERGED_TO_MAIN",
      "pullRequest": 16,
      "issue": 17,
      "parents": ["S1"],
      "head": "agent/taiwan-source-lifecycle",
      "transition": "TAIWAN_EVIDENCE_CONTRACT_DRAFT -> TAIWAN_SOURCE_LIFECYCLE_DRAFT",
      "pathLease": ["scripts/capture_taiwan_source.py", "scripts/validate_taiwan_source_lifecycle.py", "scripts/validate_taiwan_source_hardening.py", "docs/taiwan-source-lifecycle.md"],
      "evals": ["E-BASE"],
      "negativeControls": ["synthetic snapshot cannot promote", "capture has no network client", "invalid rollback denies"],
      "rollback": "79f8a65b370806925c32f0a15da88c7c0d7bda36",
      "humanAdmit": ["source/legal review", "clinical activation/rollback", "merge"],
      "mergedHeadSha": "f58a2feac580ca37bb4d7b3c30e122908bfd6b07"
    },
    {
      "id": "S3",
      "status": "MERGED_TO_MAIN",
      "pullRequest": 20,
      "issue": 19,
      "parents": ["S2"],
      "head": "agent/document-git-town-delivery-graph",
      "transition": "TAIWAN_SOURCE_LIFECYCLE_DRAFT -> DOCUMENTED_GIT_TOWN_DELIVERY_GRAPH_DRAFT",
      "pathLease": ["README.md", "README.zh-TW.md", "AGENTS.md", "docs/git/**"],
      "evals": ["E-DOC"],
      "negativeControls": ["planned work not called published", "budget block not called code result", "no runtime admission claim"],
      "rollback": "f58a2feac580ca37bb4d7b3c30e122908bfd6b07",
      "humanAdmit": ["documentation review", "merge"],
      "mergedHeadSha": "ad065c8ac944f2fb4f9d60e65b008367b1291c43"
    },
    {
      "id": "S4",
      "status": "MERGED_TO_MAIN",
      "pullRequest": 22,
      "issue": 21,
      "parents": ["S3"],
      "head": "agent/git-town-admission-candidate",
      "transition": "DOCUMENTED_GIT_TOWN_DELIVERY_GRAPH_DRAFT -> GIT_TOWN_CANDIDATE_EVIDENCE_RECORDED",
      "pathLease": ["docs/git/GIT_TOWN_ADMISSION.md", "docs/git/admission/**", "scripts/git-town/**", ".github/workflows/git-town-admission.yml"],
      "evals": ["E-GIT"],
      "negativeControls": ["runtime admission false", "consumer config absent", "publication not exercised"],
      "rollback": "ad065c8ac944f2fb4f9d60e65b008367b1291c43",
      "humanAdmit": ["runtime admission", "merge"],
      "mergedHeadSha": "a70a52cc6e3e2f4107edae2f7bb2034029161568"
    },
    {
      "id": "S5",
      "status": "DELIVERED_ON_MAIN",
      "issue": 23,
      "parents": ["S4"],
      "head": "agent/stacked-delivery-contract",
      "transition": "GIT_TOWN_CANDIDATE_EVIDENCE_RECORDED -> MACHINE_VERIFIED_STACKED_DELIVERY_DRAFT",
      "pathLease": ["docs/git/stacked-delivery-manifest.json", "docs/git/schemas/**", "scripts/validate_stacked_delivery.py"],
      "evals": ["E-GIT"],
      "negativeControls": ["cycles rejected", "digest drift rejected", "premature runtime admission rejected"],
      "rollback": "a70a52cc6e3e2f4107edae2f7bb2034029161568",
      "humanAdmit": ["governance review", "merge"]
    },
    {
      "id": "X2",
      "status": "OPEN_DRAFT_PR",
      "pullRequest": 55,
      "issue": 54,
      "parents": ["S5"],
      "head": "agent/converge-domain-validation",
      "transition": "MERGED_DOMAIN_LANES_WITH_EVIDENCE_GAPS -> DOMAIN_VALIDATORS_OWNED_BY_CI_DRAFT",
      "pathLease": ["scripts/validate_nutrition_catalog.py", "data/exercise-catalog/README.md", "data/nutrition-catalog/README.md", ".github/workflows/verify.yml"],
      "evals": ["E-BASE"],
      "negativeControls": ["no domain semantic changes", "no real source admission", "mutation self-tests must fail closed"],
      "rollback": "b1880abe317ac274b59695439c4f9682b8864f6b",
      "humanAdmit": ["merge", "source/editorial/rights admission"]
    },
    {
      "id": "X3",
      "status": "OPEN_DRAFT_PR",
      "pullRequest": 57,
      "issue": 56,
      "parents": ["X2"],
      "head": "agent/reconcile-implementation-status",
      "transition": "STALE_IMPLEMENTATION_SNAPSHOT -> CURRENT_PUBLIC_REPO_SSOT_DRAFT",
      "pathLease": ["docs/implementation-status.md"],
      "evals": ["E-DOC"],
      "negativeControls": ["public repo not called private", "merged lanes not called local-only", "historical blocked runs not called current"],
      "rollback": "1338b6fd2a1007cf06e24aca3a6a4bd07f9b7fa5",
      "humanAdmit": ["merge"]
    },
    {
      "id": "X4",
      "status": "OPEN_DRAFT_PR",
      "pullRequest": 59,
      "issue": 58,
      "parents": ["X2"],
      "head": "agent/artifact-identity-receipts",
      "transition": "HOSTED_BUILD_ARTIFACTS_WITH_AMBIGUOUS_HASH_SEMANTICS -> TRANSPORT_AND_SEMANTIC_IDENTITIES_SEPARATED_DRAFT",
      "pathLease": ["scripts/validate_artifact_identity.py", "docs/build-artifact-identity.md"],
      "evals": ["E-IDENTITY"],
      "negativeControls": ["transport identity not semantic identity", "payload mutation changes semantic identity", "debug signed not release signed"],
      "rollback": "1338b6fd2a1007cf06e24aca3a6a4bd07f9b7fa5",
      "humanAdmit": ["signing/provenance policy", "merge"]
    },
    {
      "id": "X5",
      "status": "OPEN_DRAFT_PR",
      "pullRequest": 61,
      "issue": 60,
      "parents": ["X3"],
      "head": "agent/reconcile-agent-runtime-contract",
      "transition": "STALE_AGENT_AUTHORITY_SURFACE -> CURRENT_AGENT_RUNTIME_CONTRACT_DRAFT",
      "pathLease": ["AGENTS.md"],
      "evals": ["E-DOC"],
      "negativeControls": ["hosted execution history preserved", "platform adapters not called future-only", "Human Admit remains explicit"],
      "rollback": "58e4fc14aa0347b9c47dd15ff8f7f58f8b97f8d6",
      "humanAdmit": ["merge"]
    },
    {
      "id": "X6",
      "status": "OPEN_DRAFT_PR",
      "pullRequest": 63,
      "issue": 62,
      "parents": ["X5"],
      "head": "agent/gate-authority-drift",
      "transition": "MANUALLY_RECONCILED_AUTHORITY -> MACHINE_GATED_AUTHORITY_DRAFT",
      "pathLease": ["scripts/validate_authority_surfaces.py", "docs/authority-surface-contract.md"],
      "evals": ["E-DOC"],
      "negativeControls": ["stale private claim rejected", "stale no-runner claim rejected", "runtime admission collapse rejected"],
      "rollback": "7a59f6b80f806476fdcea90f4b7722dc0ecc8ef3",
      "humanAdmit": ["merge"]
    },
    {
      "id": "X7",
      "status": "OPEN_DRAFT_PR",
      "pullRequest": 65,
      "issue": 64,
      "parents": ["X6"],
      "head": "agent/reconcile-readme-authority",
      "transition": "MACHINE_GATED_AGENT_STATUS_AUTHORITY -> README_AUTHORITY_RECONCILED_AND_GATED_DRAFT",
      "pathLease": ["README.md", "README.zh-TW.md"],
      "evals": ["E-DOC"],
      "negativeControls": ["README no-runner drift rejected", "README platform drift rejected", "README license drift rejected"],
      "rollback": "0c76c71413a73194986418e5f24571840623197f",
      "humanAdmit": ["merge"]
    },
    {
      "id": "X8",
      "status": "OPEN_DRAFT_PR",
      "pullRequest": 67,
      "issue": 66,
      "parents": ["X7"],
      "head": "agent/reconcile-delivery-machine-ssot",
      "transition": "PUBLIC_AUTHORITY_SURFACES_CURRENT_BUT_DELIVERY_GRAPH_STALE -> LIVE_DELIVERY_GRAPH_RECONCILED_DRAFT",
      "pathLease": ["docs/github-issue-index.md", "docs/git/STACKED_PRS.md", "docs/git/stacked-delivery-manifest.json"],
      "evals": ["E-DOC", "E-GIT"],
      "negativeControls": ["historical blocked evidence not called current", "open issue not treated as absent implementation", "narrative and manifest digest must match"],
      "rollback": "3046807758d025e0a9ad903f1109d1c6942e312f",
      "humanAdmit": ["merge", "all external gates remain separate"]
    },
    {
      "id": "G1",
      "status": "PLANNED_WORK_PACKET",
      "issue": 44,
      "parents": ["X8"],
      "head": "agent/release-convergence-index",
      "transition": "LIVE_DELIVERY_GRAPH_RECONCILED_DRAFT -> RELEASE_CONVERGENCE_DRAFT",
      "pathLease": ["docs/release/convergence/**"],
      "evals": ["E-BASE", "E-DOC", "E-GIT"],
      "negativeControls": ["stale or failed parent rejected", "convergence cannot repair domain code", "missing external evidence stays missing"],
      "rollback": "exact X8 admitted head",